{
  "$schema": "https://json-schema.org/draft/2020-12/schema",
  "$id": "https://atlas.internationalbrainlab.org/schema/v1/catalog.schema.json",
  "title": "Public dataset catalog v1",
  "type": "object",
  "additionalProperties": false,
  "required": ["schema_version", "default_project", "projects", "datasets"],
  "properties": {
    "schema_version": {"const": "1.0"},
    "publication_id": {"type": "string", "pattern": "^[0-9a-f]{32}$", "description": "Optional unique publication generation; never a scientific edition identity."},
    "default_project": {"$ref": "common.schema.json#/$defs/identifier"},
    "projects": {
      "type": "array", "minItems": 1,
      "items": {
        "type": "object", "additionalProperties": false,
        "required": ["project_id", "title", "dataset_ids", "default_dataset", "editions"],
        "properties": {
          "project_id": {"$ref": "common.schema.json#/$defs/identifier"},
          "title": {"type": "string", "minLength": 1},
          "description": {"type": "string"},
          "dataset_ids": {"type": "array", "minItems": 1, "uniqueItems": true, "items": {"$ref": "common.schema.json#/$defs/datasetId"}},
          "default_dataset": {"$ref": "common.schema.json#/$defs/datasetId"},
          "default_edition": {"$ref": "common.schema.json#/$defs/identifier"},
          "editions": {
            "type": "array",
            "items": {
              "type": "object", "additionalProperties": false,
              "required": ["edition_id", "label", "dataset_releases"],
              "properties": {
                "edition_id": {"$ref": "common.schema.json#/$defs/identifier"},
                "label": {"type": "string", "minLength": 1},
                "description": {"type": "string"},
                "dataset_releases": {
                  "type": "array", "minItems": 1,
                  "items": {"type": "object", "additionalProperties": false, "required": ["dataset_id", "release_id"], "properties": {"dataset_id": {"$ref": "common.schema.json#/$defs/datasetId"}, "release_id": {"$ref": "common.schema.json#/$defs/identifier"}}}
                }
              }
            }
          }
        }
      }
    },
    "datasets": {
      "type": "array",
      "items": {
        "type": "object",
        "additionalProperties": false,
        "required": ["dataset_id", "title", "default_release", "releases"],
        "properties": {
          "dataset_id": {"$ref": "common.schema.json#/$defs/datasetId"},
          "title": {"type": "string", "minLength": 1},
          "description": {"type": "string"},
          "default_release": {"$ref": "common.schema.json#/$defs/identifier"},
          "releases": {
            "type": "array",
            "minItems": 1,
            "items": {
              "type": "object",
              "additionalProperties": false,
              "required": ["release_id", "label", "manifest"],
              "properties": {
                "release_id": {"$ref": "common.schema.json#/$defs/identifier"},
                "label": {"type": "string", "minLength": 1},
                "status": {"enum": ["legacy", "development"]},
                "description": {"type": "string"},
                "manifest": {"$ref": "common.schema.json#/$defs/encodedResource"}
              }
            }
          }
        }
      }
    }
  }
}
