{"datasets":[{"dataset_id":"ephys_atlas_channels","default_release":"2026_W39-ibl-review-20261007-v1","releases":[{"label":"2026 W32","manifest":{"bytes":41590,"codec":{"decoded_bytes":41590,"name":"none"},"media_type":"application/json","path":"./datasets/ephys_atlas_channels/releases/2026_W32-ibl-review-20260908-v1/manifest.json","sha256":"77da1a8c0b192b0c338595e4db9628ebea0ae715d4593df764d22c5261fcb3b6"},"release_id":"2026_W32-ibl-review-20260908-v1"},{"label":"2026 W39","manifest":{"bytes":32647,"codec":{"decoded_bytes":32647,"name":"none"},"media_type":"application/json","path":"./datasets/ephys_atlas_channels/releases/2026_W39-ibl-review-20261007-v1/manifest.json","sha256":"6adc9fa963196d6db829125c5ac869c49bec7622ec7397e8503965f79476a2b8"},"release_id":"2026_W39-ibl-review-20261007-v1"}],"title":"Channels"},{"dataset_id":"ephys_atlas_clusters","default_release":"sha256-9b5e55215b306f26-ibl-review-20260908-v1","releases":[{"label":"Frozen cluster snapshot","manifest":{"bytes":14130,"codec":{"decoded_bytes":14130,"name":"none"},"media_type":"application/json","path":"./datasets/ephys_atlas_clusters/releases/sha256-9b5e55215b306f26-ibl-review-20260908-v1/manifest.json","sha256":"c28936c8819c4e7f06f31afe69bf71a94b5f52d530e2c269dfc79a216f4f2c6c"},"release_id":"sha256-9b5e55215b306f26-ibl-review-20260908-v1"}],"title":"Clusters"},{"dataset_id":"ephys_atlas_volumes","default_release":"2026_W39-ibl-review-20261007-v1","releases":[{"label":"2026 W26","manifest":{"bytes":24142,"codec":{"decoded_bytes":24142,"name":"none"},"media_type":"application/json","path":"./datasets/ephys_atlas_volumes/releases/2026_W26-ibl-review-20260908-v1/manifest.json","sha256":"16be30752447b3d99411ac982e7ed0e49f2b1d4f6a5d11c3ceeefb11c946fa7e"},"release_id":"2026_W26-ibl-review-20260908-v1"},{"label":"2026 W26 \u00b7 regional distributions","manifest":{"bytes":28192,"codec":{"decoded_bytes":28192,"name":"none"},"media_type":"application/json","path":"./datasets/ephys_atlas_volumes/releases/2026_W26-ibl-review-20260917-v2/manifest.json","sha256":"ff982c8746edb6028f147233a2fbf65db7c25a91d2c2f7331c9f0118ea99e0dc"},"release_id":"2026_W26-ibl-review-20260917-v2"},{"label":"2026 W39","manifest":{"bytes":29336,"codec":{"decoded_bytes":29336,"name":"none"},"media_type":"application/json","path":"./datasets/ephys_atlas_volumes/releases/2026_W39-ibl-review-20261007-v1/manifest.json","sha256":"99bcd4075943b86f62e5f0a5be5fbbc1ec439a4a797f9ed705e7b0a37a7e4c71"},"release_id":"2026_W39-ibl-review-20261007-v1"}],"title":"Volumes"},{"dataset_id":"agea","default_release":"agea-processed-20260917-v3","releases":[{"label":"Original expression","manifest":{"bytes":2033446,"codec":{"decoded_bytes":2033446,"name":"none"},"media_type":"application/json","path":"./datasets/agea/releases/agea-original-20260908-v1/manifest.json","sha256":"80f61920fa53e17ad1908075984460e1d8fd5f50b259ec9abc6617b8f781c383"},"release_id":"agea-original-20260908-v1"},{"label":"Processed expression","manifest":{"bytes":2037757,"codec":{"decoded_bytes":2037757,"name":"none"},"media_type":"application/json","path":"./datasets/agea/releases/agea-processed-20260917-v3/manifest.json","sha256":"36c7758d44531c0c3932262f9e275393b310a5b1e87e0e2011980be6f7e5c2da"},"release_id":"agea-processed-20260917-v3"}],"title":"AGEA"},{"dataset_id":"ephys_atlas_edges","default_release":"2026_W39-edges-ibl-review-20261007-v1","releases":[{"label":"2026 W39","manifest":{"bytes":8912,"codec":{"decoded_bytes":8912,"name":"none"},"media_type":"application/json","path":"./datasets/ephys_atlas_edges/releases/2026_W39-edges-ibl-review-20261007-v1/manifest.json","sha256":"b42e72d6180345b231a71ef4bcd5efafd0ece42ff84decdbe479e0dd33533d9f"},"release_id":"2026_W39-edges-ibl-review-20261007-v1"}],"title":"Edges"},{"dataset_id":"merfish_class","default_release":"class-processed-all-3b4a73f-ibl-review-20261007-v1","releases":[{"label":"Denoised classes","manifest":{"bytes":22373,"codec":{"decoded_bytes":22373,"name":"none"},"media_type":"application/json","path":"./datasets/merfish_class/releases/class-processed-all-3b4a73f-ibl-review-20261007-v1/manifest.json","sha256":"5564ad8dcfc6731f1638e28eefbcd80d310f6c1da12ba9c9364edec6b564816c"},"release_id":"class-processed-all-3b4a73f-ibl-review-20261007-v1"}],"title":"MERFISH cell classes"},{"dataset_id":"lipids","default_release":"lba-2025-3b4a73f-ibl-review-20261007-v1","releases":[{"label":"Lipid Brain Atlas 2025","manifest":{"bytes":87850,"codec":{"decoded_bytes":87850,"name":"none"},"media_type":"application/json","path":"./datasets/lipids/releases/lba-2025-3b4a73f-ibl-review-20261007-v1/manifest.json","sha256":"3d2b836b6046f80ee3fe159dbbc657d67c77dd0dc35f417b7825e45d54d7c331"},"release_id":"lba-2025-3b4a73f-ibl-review-20261007-v1"}],"title":"Lipid Brain Atlas"}],"default_project":"ephys-atlas","projects":[{"dataset_ids":["ephys_atlas_channels","ephys_atlas_clusters","ephys_atlas_volumes","ephys_atlas_edges"],"default_dataset":"ephys_atlas_channels","default_edition":"ibl-review-20261007-v4","editions":[{"dataset_releases":[{"dataset_id":"ephys_atlas_channels","release_id":"2026_W32-ibl-review-20260908-v1"},{"dataset_id":"ephys_atlas_clusters","release_id":"sha256-9b5e55215b306f26-ibl-review-20260908-v1"}],"edition_id":"ibl-review-20260908-v1","label":"September 2026"},{"dataset_releases":[{"dataset_id":"ephys_atlas_channels","release_id":"2026_W32-ibl-review-20260908-v1"},{"dataset_id":"ephys_atlas_clusters","release_id":"sha256-9b5e55215b306f26-ibl-review-20260908-v1"},{"dataset_id":"ephys_atlas_volumes","release_id":"2026_W26-ibl-review-20260908-v1"}],"edition_id":"ibl-review-20260908-v2","label":"September 2026 (with volumes)"},{"dataset_releases":[{"dataset_id":"ephys_atlas_channels","release_id":"2026_W32-ibl-review-20260908-v1"},{"dataset_id":"ephys_atlas_clusters","release_id":"sha256-9b5e55215b306f26-ibl-review-20260908-v1"},{"dataset_id":"ephys_atlas_volumes","release_id":"2026_W26-ibl-review-20260917-v2"}],"edition_id":"ibl-review-20260917-v3","label":"September 2026 (regional volumes)"},{"dataset_releases":[{"dataset_id":"ephys_atlas_channels","release_id":"2026_W39-ibl-review-20261007-v1"},{"dataset_id":"ephys_atlas_clusters","release_id":"sha256-9b5e55215b306f26-ibl-review-20260908-v1"},{"dataset_id":"ephys_atlas_volumes","release_id":"2026_W39-ibl-review-20261007-v1"},{"dataset_id":"ephys_atlas_edges","release_id":"2026_W39-edges-ibl-review-20261007-v1"}],"edition_id":"ibl-review-20261007-v4","label":"October 2026 (W39)"}],"project_id":"ephys-atlas","title":"Ephys Atlas"},{"dataset_ids":["agea","merfish_class"],"default_dataset":"agea","default_edition":"ibl-review-20261007-v1","editions":[{"dataset_releases":[{"dataset_id":"agea","release_id":"agea-processed-20260917-v3"},{"dataset_id":"merfish_class","release_id":"class-processed-all-3b4a73f-ibl-review-20261007-v1"}],"edition_id":"ibl-review-20261007-v1","label":"October 2026"}],"project_id":"genomics","title":"Genomics"},{"dataset_ids":["lipids"],"default_dataset":"lipids","default_edition":"ibl-review-20261007-v1","editions":[{"dataset_releases":[{"dataset_id":"lipids","release_id":"lba-2025-3b4a73f-ibl-review-20261007-v1"}],"edition_id":"ibl-review-20261007-v1","label":"October 2026"}],"project_id":"lipidome","title":"Lipidome"}],"publication_id":"142f16ccf087412aa1ff0532a4b93997","schema_version":"1.0"}
