{"datasets":[{"dataset_id":"ephys_atlas_channels","default_release":"2026_W32-ibl-review-20260908-v1","releases":[{"label":"2026 W32","manifest":{"bytes":41590,"codec":{"decoded_bytes":41590,"name":"none"},"media_type":"application/json","path":"./datasets/ephys_atlas_channels/releases/2026_W32-ibl-review-20260908-v1/manifest.json","sha256":"77da1a8c0b192b0c338595e4db9628ebea0ae715d4593df764d22c5261fcb3b6"},"release_id":"2026_W32-ibl-review-20260908-v1"}],"title":"Channels"},{"dataset_id":"ephys_atlas_clusters","default_release":"sha256-9b5e55215b306f26-ibl-review-20260908-v1","releases":[{"label":"Frozen cluster snapshot","manifest":{"bytes":14130,"codec":{"decoded_bytes":14130,"name":"none"},"media_type":"application/json","path":"./datasets/ephys_atlas_clusters/releases/sha256-9b5e55215b306f26-ibl-review-20260908-v1/manifest.json","sha256":"c28936c8819c4e7f06f31afe69bf71a94b5f52d530e2c269dfc79a216f4f2c6c"},"release_id":"sha256-9b5e55215b306f26-ibl-review-20260908-v1"}],"title":"Clusters"},{"dataset_id":"ephys_atlas_volumes","default_release":"2026_W26-ibl-review-20260917-v2","releases":[{"label":"2026 W26","manifest":{"bytes":24142,"codec":{"decoded_bytes":24142,"name":"none"},"media_type":"application/json","path":"./datasets/ephys_atlas_volumes/releases/2026_W26-ibl-review-20260908-v1/manifest.json","sha256":"16be30752447b3d99411ac982e7ed0e49f2b1d4f6a5d11c3ceeefb11c946fa7e"},"release_id":"2026_W26-ibl-review-20260908-v1"},{"label":"2026 W26 \u00b7 regional distributions","manifest":{"bytes":28192,"codec":{"decoded_bytes":28192,"name":"none"},"media_type":"application/json","path":"./datasets/ephys_atlas_volumes/releases/2026_W26-ibl-review-20260917-v2/manifest.json","sha256":"ff982c8746edb6028f147233a2fbf65db7c25a91d2c2f7331c9f0118ea99e0dc"},"release_id":"2026_W26-ibl-review-20260917-v2"}],"title":"Volumes"},{"dataset_id":"brainwide_map","default_release":"legacy-v1-1d908bea-ibl-review-20260908-v1","releases":[{"label":"Legacy website snapshot","manifest":{"bytes":20988,"codec":{"decoded_bytes":20988,"name":"none"},"media_type":"application/json","path":"./datasets/brainwide_map/releases/legacy-v1-1d908bea-ibl-review-20260908-v1/manifest.json","sha256":"ae03114ff1544c91a27b7d3ad9cc2fc06d690cb4bfcc93a5d9a495fe919fdb6a"},"release_id":"legacy-v1-1d908bea-ibl-review-20260908-v1","status":"legacy"}],"title":"Brain-Wide Map"},{"dataset_id":"agea","default_release":"agea-processed-20260917-v3","releases":[{"label":"Original expression","manifest":{"bytes":2033446,"codec":{"decoded_bytes":2033446,"name":"none"},"media_type":"application/json","path":"./datasets/agea/releases/agea-original-20260908-v1/manifest.json","sha256":"80f61920fa53e17ad1908075984460e1d8fd5f50b259ec9abc6617b8f781c383"},"release_id":"agea-original-20260908-v1"},{"label":"Processed expression","manifest":{"bytes":2037757,"codec":{"decoded_bytes":2037757,"name":"none"},"media_type":"application/json","path":"./datasets/agea/releases/agea-processed-20260917-v3/manifest.json","sha256":"36c7758d44531c0c3932262f9e275393b310a5b1e87e0e2011980be6f7e5c2da"},"release_id":"agea-processed-20260917-v3"}],"title":"AGEA"}],"default_project":"ephys-atlas","projects":[{"dataset_ids":["ephys_atlas_channels","ephys_atlas_clusters","ephys_atlas_volumes"],"default_dataset":"ephys_atlas_channels","default_edition":"ibl-review-20260917-v3","editions":[{"dataset_releases":[{"dataset_id":"ephys_atlas_channels","release_id":"2026_W32-ibl-review-20260908-v1"},{"dataset_id":"ephys_atlas_clusters","release_id":"sha256-9b5e55215b306f26-ibl-review-20260908-v1"}],"edition_id":"ibl-review-20260908-v1","label":"September 2026"},{"dataset_releases":[{"dataset_id":"ephys_atlas_channels","release_id":"2026_W32-ibl-review-20260908-v1"},{"dataset_id":"ephys_atlas_clusters","release_id":"sha256-9b5e55215b306f26-ibl-review-20260908-v1"},{"dataset_id":"ephys_atlas_volumes","release_id":"2026_W26-ibl-review-20260908-v1"}],"edition_id":"ibl-review-20260908-v2","label":"September 2026 (with volumes)"},{"dataset_releases":[{"dataset_id":"ephys_atlas_channels","release_id":"2026_W32-ibl-review-20260908-v1"},{"dataset_id":"ephys_atlas_clusters","release_id":"sha256-9b5e55215b306f26-ibl-review-20260908-v1"},{"dataset_id":"ephys_atlas_volumes","release_id":"2026_W26-ibl-review-20260917-v2"}],"edition_id":"ibl-review-20260917-v3","label":"September 2026 (regional volumes)"}],"project_id":"ephys-atlas","title":"Ephys Atlas"},{"dataset_ids":["brainwide_map"],"default_dataset":"brainwide_map","default_edition":"ibl-review-20260908-v1","editions":[{"dataset_releases":[{"dataset_id":"brainwide_map","release_id":"legacy-v1-1d908bea-ibl-review-20260908-v1"}],"edition_id":"ibl-review-20260908-v1","label":"September 2026"}],"project_id":"brainwide-map","title":"Brain-Wide Map"},{"dataset_ids":["agea"],"default_dataset":"agea","default_edition":"ibl-review-20260917-v2","editions":[{"dataset_releases":[{"dataset_id":"agea","release_id":"agea-original-20260908-v1"}],"edition_id":"ibl-review-20260908-v1","label":"September 2026"},{"dataset_releases":[{"dataset_id":"agea","release_id":"agea-processed-20260917-v3"}],"edition_id":"ibl-review-20260917-v2","label":"September 2026 (processed expression)"}],"project_id":"agea","title":"Anatomy"}],"publication_id":"2a152441f24c4c0a81bdad190e3e507c","schema_version":"1.0"}
